{
  "version": "2.2.0",
  "source": "content/knowledge/knowledge-graph.json",
  "nodes": [
    {
      "id": "matter-change",
      "name": "物质的变化",
      "chapter": "单元一 走进化学世界",
      "domain": "matter",
      "bloomLevels": [
        "remember",
        "understand"
      ],
      "questions": [
        "L01-Q01",
        "L01-Q02",
        "L01-Q07",
        "L01-P06",
        "L01-P08",
        "L01-D03",
        "L01-M05",
        "L01-M10",
        "L01-M15",
        "L01-M16",
        "L01-M19"
      ],
      "semester": "upper",
      "unitId": "u01",
      "definition": "物质发生变化时，可能产生新物质（化学变化），也可能不产生新物质（物理变化）。判断依据是是否有新物质生成。",
      "prerequisiteIds": [],
      "misconceptionIds": [
        "mc-matter-change-vs-property",
        "mc-matter-physical-vs-chemical"
      ],
      "remediationGoal": "理解\"是否生成新物质\"是判断物理变化与化学变化的根本标准，而非外观或状态改变。"
    },
    {
      "id": "physical-change",
      "name": "物理变化",
      "chapter": "单元一 走进化学世界",
      "domain": "matter",
      "bloomLevels": [
        "remember",
        "understand"
      ],
      "questions": [
        "L01-Q01",
        "L01-Q07",
        "L01-P01",
        "L01-P02",
        "L01-D01",
        "L01-M01",
        "L01-M06",
        "L01-M11",
        "L01-M18",
        "L01-M21"
      ],
      "semester": "upper",
      "unitId": "u01",
      "definition": "没有生成其他物质的变化，如状态改变、形状改变、破碎等，变化前后物质的化学组成不变。",
      "prerequisiteIds": [
        "matter-change"
      ],
      "misconceptionIds": [
        "mc-matter-physical-vs-chemical",
        "mc-method-single-phenomenon-overgeneralization"
      ],
      "remediationGoal": "能用\"生成新物质\"判断变化类别，不将颜色、形态改变等同于化学变化。"
    },
    {
      "id": "chemical-change",
      "name": "化学变化",
      "chapter": "单元一 走进化学世界",
      "domain": "matter",
      "bloomLevels": [
        "remember",
        "understand"
      ],
      "questions": [
        "L01-Q02",
        "L01-P01",
        "L01-P02",
        "L01-D01",
        "L01-M01",
        "L01-M06",
        "L01-M11",
        "L01-M18",
        "L01-M21",
        "L01-T02"
      ],
      "semester": "upper",
      "unitId": "u01",
      "definition": "生成其他物质的变化，常伴随发光、发热、颜色改变、产生气体或沉淀等现象，但现象只是证据，本质是生成新物质。",
      "prerequisiteIds": [
        "matter-change"
      ],
      "misconceptionIds": [
        "mc-matter-physical-vs-chemical",
        "mc-method-single-phenomenon-overgeneralization"
      ],
      "remediationGoal": "以\"生成新物质\"为判断依据，现象只是辅助证据，不能以单一现象代替本质判断。"
    },
    {
      "id": "physical-property",
      "name": "物理性质",
      "chapter": "单元一 走进化学世界",
      "domain": "matter",
      "bloomLevels": [
        "remember",
        "understand",
        "apply"
      ],
      "questions": [
        "L01-Q03",
        "L01-P03",
        "L01-D03",
        "L01-M02",
        "L01-M08",
        "L01-M13",
        "L01-T03",
        "L03-Q03",
        "L03-Q04",
        "L03-P02",
        "L03-P07",
        "L03-M02"
      ],
      "semester": "upper",
      "unitId": "u01",
      "definition": "物质不需要发生化学变化就能表现出来的性质，如颜色、状态、气味、熔点、沸点、密度、硬度、导电性等。",
      "prerequisiteIds": [
        "physical-change"
      ],
      "misconceptionIds": [
        "mc-matter-change-vs-property"
      ],
      "remediationGoal": "区分\"性质\"（能力描述）与\"变化\"（过程描述），不将性质判断等同于变化发生。"
    },
    {
      "id": "chemical-property",
      "name": "化学性质",
      "chapter": "单元一 走进化学世界",
      "domain": "matter",
      "bloomLevels": [
        "understand",
        "apply"
      ],
      "questions": [
        "L01-Q04",
        "L01-P04",
        "L01-D03",
        "L01-M03",
        "L01-M07",
        "L01-M14",
        "L01-T03",
        "L03-Q02",
        "L03-Q05",
        "L03-P03",
        "L03-P04",
        "L03-P05",
        "L03-P09",
        "L03-P10",
        "L03-P11",
        "L03-P13",
        "L03-D03",
        "L03-M03",
        "L03-M04",
        "L03-M07",
        "L03-M09",
        "L03-M11",
        "L03-M12",
        "L03-M13",
        "L03-M15",
        "L03-M18",
        "L03-M19"
      ],
      "semester": "upper",
      "unitId": "u01",
      "definition": "物质在化学变化中表现出来的性质，如可燃性、氧化性、还原性、酸碱性、稳定性等。",
      "prerequisiteIds": [
        "chemical-change"
      ],
      "misconceptionIds": [
        "mc-matter-change-vs-property"
      ],
      "remediationGoal": "理解化学性质必须通过化学变化才能表现，能用\"能否发生某反应\"判断化学性质。"
    },
    {
      "id": "observation-inference",
      "name": "观察与推理",
      "chapter": "单元一 走进化学世界",
      "domain": "method",
      "bloomLevels": [
        "understand",
        "apply",
        "analyze"
      ],
      "questions": [
        "L01-Q05",
        "L01-Q06",
        "L01-Q08",
        "L01-P06",
        "L01-P08",
        "L01-M05",
        "L01-M10",
        "L01-M15",
        "L01-M16",
        "L01-M19",
        "L01-M20",
        "L01-T01",
        "L01-T02",
        "L02-Q02",
        "L02-Q06",
        "L02-P01",
        "L02-P06",
        "L02-P10",
        "L02-P12",
        "L02-D01",
        "L02-M02",
        "L02-M06",
        "L02-M11",
        "L02-M15",
        "L02-M19",
        "L02-M20",
        "L02-T02",
        "L03-Q04",
        "L03-P03",
        "L03-D01",
        "L03-M03",
        "L03-M06",
        "L03-M13",
        "L03-M20"
      ],
      "semester": "upper",
      "unitId": "u01",
      "definition": "观察是直接用感官或仪器获取信息（证据），推断是根据证据得出结论。两者不可混为一谈。",
      "prerequisiteIds": [
        "scientific-inquiry"
      ],
      "misconceptionIds": [
        "mc-method-observation-inference"
      ],
      "remediationGoal": "建立\"观察→证据→推理→结论\"的科学思维链，区分可观察现象与主观解释。"
    },
    {
      "id": "evidence-reasoning",
      "name": "证据与结论",
      "chapter": "单元一 走进化学世界",
      "domain": "method",
      "bloomLevels": [
        "apply",
        "analyze",
        "evaluate"
      ],
      "questions": [
        "L01-Q05",
        "L01-Q06",
        "L01-Q08",
        "L01-P05",
        "L01-P07",
        "L01-D02",
        "L01-M04",
        "L01-M09",
        "L01-M12",
        "L01-M17",
        "L01-M20",
        "L01-M21",
        "L01-T01",
        "L01-T04",
        "L02-Q05",
        "L02-Q08",
        "L02-P05",
        "L02-P08",
        "L02-P09",
        "L02-P10",
        "L02-P11",
        "L02-P12",
        "L02-M05",
        "L02-M10",
        "L02-M18",
        "L02-M20",
        "L02-M21",
        "L02-T02",
        "L02-T04",
        "L03-Q05",
        "L03-P05",
        "L03-P07",
        "L03-P09",
        "L03-P10",
        "L03-P11",
        "L03-P13",
        "L03-M06",
        "L03-M07",
        "L03-M09",
        "L03-M11",
        "L03-M12",
        "L03-M16",
        "L03-M18",
        "L03-M19",
        "L03-M20"
      ],
      "semester": "upper",
      "unitId": "u01",
      "definition": "以证据为基础进行推理，结论必须能被证据支撑；单一现象不足以得出确定结论，需要多角度证据验证。",
      "prerequisiteIds": [
        "observation-inference"
      ],
      "misconceptionIds": [
        "mc-method-single-phenomenon-overgeneralization",
        "mc-method-evidence-logic"
      ],
      "remediationGoal": "养成用多源证据支持结论的习惯，避免以单一现象直接下判断。"
    },
    {
      "id": "scientific-inquiry",
      "name": "科学探究",
      "chapter": "单元一 走进化学世界",
      "domain": "method",
      "bloomLevels": [
        "understand",
        "apply",
        "analyze"
      ],
      "questions": [
        "L01-T04",
        "L02-Q01",
        "L02-P02",
        "L02-P11",
        "L02-M01",
        "L02-M07",
        "L02-M13",
        "L02-T03",
        "L03-M16"
      ],
      "semester": "upper",
      "unitId": "u01",
      "definition": "科学探究的基本过程：提出问题→作出假设→设计实验→收集证据→得出结论→反思评价，强调证据驱动和逻辑推理。",
      "prerequisiteIds": [],
      "misconceptionIds": [
        "mc-method-observation-inference"
      ],
      "remediationGoal": "掌握科学探究的基本流程，理解每个环节的逻辑关系，能独立设计简单对照实验。"
    },
    {
      "id": "control-variables",
      "name": "控制变量",
      "chapter": "单元一 走进化学世界",
      "domain": "method",
      "bloomLevels": [
        "understand",
        "apply"
      ],
      "questions": [
        "L02-Q03",
        "L02-Q07",
        "L02-P03",
        "L02-P07",
        "L02-P13",
        "L02-D02",
        "L02-M03",
        "L02-M08",
        "L02-M12",
        "L02-M16",
        "L02-M21",
        "L02-T01",
        "L03-P13"
      ],
      "semester": "upper",
      "unitId": "u01",
      "definition": "对照实验中只改变一个因素（自变量），其他因素保持不变（控制变量），以确保实验结果的变化确实由该因素引起。",
      "prerequisiteIds": [],
      "misconceptionIds": [
        "mc-method-control-variable"
      ],
      "remediationGoal": "能识别实验中的自变量、因变量和控制变量，设计合理的对照实验方案。"
    },
    {
      "id": "data-integrity",
      "name": "数据真实性",
      "chapter": "单元一 走进化学世界",
      "domain": "method",
      "bloomLevels": [
        "understand",
        "apply",
        "evaluate"
      ],
      "questions": [
        "L02-Q04",
        "L02-P04",
        "L02-P13",
        "L02-D03",
        "L02-M04",
        "L02-M09",
        "L02-M14",
        "L02-M17",
        "L02-T03",
        "L02-T04",
        "L03-P12",
        "L03-D02"
      ],
      "semester": "upper",
      "unitId": "u01",
      "definition": "实验数据必须真实、完整、可重复；不能选择性记录或编造数据，异常数据需要如实记录并分析原因。",
      "prerequisiteIds": [],
      "misconceptionIds": [
        "mc-method-data-integrity"
      ],
      "remediationGoal": "理解数据真实性是科学结论的基础，掌握重复实验和样本量对结论可靠性的意义。"
    },
    {
      "id": "acid-intro",
      "name": "常见的酸",
      "chapter": "第十单元 酸和碱",
      "domain": "substance",
      "bloomLevels": [
        "remember",
        "understand"
      ],
      "questions": [
        "L03-P08",
        "L03-M01",
        "L03-M08",
        "L03-M14"
      ],
      "prerequisites": [
        "physical-property",
        "chemical-property",
        "safety-awareness"
      ],
      "semester": "lower",
      "unitId": "u10",
      "definition": "酸在水溶液中都能电离出氢离子（H⁺），这是酸的共性；不同酸的强弱由电离程度决定，与浓度是两个独立概念。",
      "prerequisiteIds": [],
      "misconceptionIds": [
        "mc-acid-hcl-solution",
        "mc-acid-property",
        "mc-method-single-phenomenon-overgeneralization"
      ],